{
  "version": "v0",
  "generated_at": "2026-02-24T16:30:00.000Z",
  "total": 2,
  "limit": 50,
  "offset": 0,
  "items": [
    {
      "patch_id": "pph_abc123def456",
      "profile_name": "workspace_ops_cn",
      "operation": "rollback",
      "rollback_target_patch_id": "pph_111122223333",
      "rollback_target_state": "before",
      "actor_id": "usr_yingapple",
      "reason": "rollback to pre-change baseline",
      "applied_at": "2026-02-24T16:20:00.000Z",
      "file_path": "/Users/yingapple/Documents/yx_self/flockmesh/policies/workspace_ops_cn.policy.json",
      "before_profile_hash": "sha256:ee18ba13f30f97a8f7648d405667c4549f2d675afdb80743b66cab88b9e70768",
      "after_profile_hash": "sha256:d8bd9689cc3b31d1e8f7ecddf06d44fac4977deca4b991194f47b6670a3cc70a",
      "summary": {
        "total_rules_before": 3,
        "total_rules_after": 2,
        "patch_rules": 1,
        "added": 0,
        "updated": 0,
        "removed": 1,
        "unchanged": 2
      },
      "changes": {
        "added_capabilities": [],
        "updated_capabilities": [],
        "removed_capabilities": [
          "ticket.create"
        ],
        "unchanged_capabilities": [
          "doc.write",
          "message.send"
        ]
      }
    },
    {
      "patch_id": "pph_111122223333",
      "profile_name": "workspace_ops_cn",
      "operation": "patch",
      "rollback_target_patch_id": "",
      "rollback_target_state": "",
      "actor_id": "usr_yingapple",
      "reason": "enable approval path for ticket.create",
      "applied_at": "2026-02-24T16:00:00.000Z",
      "file_path": "/Users/yingapple/Documents/yx_self/flockmesh/policies/workspace_ops_cn.policy.json",
      "before_profile_hash": "sha256:d8bd9689cc3b31d1e8f7ecddf06d44fac4977deca4b991194f47b6670a3cc70a",
      "after_profile_hash": "sha256:ee18ba13f30f97a8f7648d405667c4549f2d675afdb80743b66cab88b9e70768",
      "summary": {
        "total_rules_before": 2,
        "total_rules_after": 3,
        "patch_rules": 1,
        "added": 1,
        "updated": 0,
        "removed": 0,
        "unchanged": 2
      },
      "changes": {
        "added_capabilities": [
          "ticket.create"
        ],
        "updated_capabilities": [],
        "removed_capabilities": [],
        "unchanged_capabilities": [
          "doc.write",
          "message.send"
        ]
      }
    }
  ]
}
